{
  "schema": "https://agent-atoms.com/schemas/atom-v1.json",
  "type": "tool-definition",
  "id": "file-delete",
  "version": "1.0.0",
  "name": "file-delete",
  "description": "Remove a file. Destructive. Requires explicit user approval.",
  "tool_spec": {
    "function_name": "file_delete",
    "summary": "Delete a file at a path.",
    "parameters": {
      "path": { "type": "string", "description": "File path", "required": true }
    },
    "returns": { "type": "object", "description": "{path, removed}." },
    "side_effects": ["fs-write", "user-prompt"]
  }
}
