{
  "schema": "https://agent-atoms.com/schemas/atom-v1.json",
  "type": "capability-declaration",
  "id": "db-read-write",
  "version": "1.0.0",
  "name": "DB read-write",
  "description": "All DML against a named DSN. INSERT / UPDATE / DELETE.",
  "capability": {
    "grants": ["network", "user-prompt"],
    "elevation": "user-approved",
    "audit": true
  }
}
